{"$schema":"https://json-schema.org/draft/2020-12/schema","type":"object","required":["versions","defaults","capabilities","thresholdProfiles"],"properties":{"versions":{"type":"object","required":["generator","rules","templates","capabilities"]},"defaults":{"type":"object"},"capabilities":{"type":"array","items":{"type":"object","required":["capabilityId","exerciseIds","view","measurement","requiredLandmarks","validationStatus","thresholdProfileId","supportedFindings","unsupportedFindings","cameraGuidance","analysisScope","limitations"]}},"thresholdProfiles":{"type":"object"}}}
